### ISSUE TITLE
high frequently data transmission leads to transmission errors/client disconnects

### ISSUE THREAD

**Issue by marcel-behlau-elfin** [redboltz/mqtt_cpp#196]
Hi,

i observe a problem, that high frequently data transmission (publishing, subscribing, receiving) affects problems within the connection/transmission. This affects (sometimes) one of the following problems:
1. ill formed "topics"
2. client disconnect
3. interruption of transmission of queued messages

> 1554222223: Received PUBLISH from subscribe (d0, q1, r0, m28528, '@
>                                                                    Zt', ... (7 bytes))
> 

My mosquitto (version 1.5.5) can't display the payload, but i assume, they are also ill formed if the problem occurs.

To create a high frequently data transmission, queued messages works great for me.

For this, just create a tls client with persistent session and subscribe to a topic with qos > 0. Afterwards disconnect the client and publish with an second client multiple times to the subscribed topic.

If the client reconnect to the brokers, all "missed" messages will be transmitted. If during this time the client performs an publish, this affects the described problem. First i though it's related to a async_publish, but i at lot of tries, it's also occurs within the sync_publish.

I created a minimal example to reproduce this  --> https://github.com/marcel-behlau-elfin/mqtt_cpp/tree/async_publish_error

Minimal example usage:

1. Start mosquitto with tls enabled
2. Compile examples
3. Start subscribe application and wait for subscribe
4. Stop subscribe application
5. Start publish application and wait for publish
6. Start subscribe application again

If the problem didn't occur, repeat restart at step 5.

Example log:

mosquitto log:

> 1554220655: New connection from 172.18.0.1 on port 8883.
> 1554220655: Socket error on client subscribe, disconnecting.
> 1554220655: New client connected from 172.18.0.1 as subscribe (c0, k0).
> 1554220655: No will message specified.
> 1554220655: Sending CONNACK to subscribe (1, 0)
> 1554220655: Sending PUBLISH to subscribe (d0, q1, r0, m437, 'mqtt_client_cpp/topic2_1', ... (7 bytes))
> 1554220655: Sending PUBLISH to subscribe (d0, q1, r0, m438, 'mqtt_client_cpp/topic2_1', ... (7 bytes))
> 1554220655: Sending PUBLISH to subscribe (d0, q1, r0, m439, 'mqtt_client_cpp/topic2_1', ... (7 bytes))
> 1554220655: Sending PUBLISH to subscribe (d0, q1, r0, m440, 'mqtt_client_cpp/topic2_1', ... (7 bytes))
> 1554220655: Sending PUBLISH to subscribe (d0, q1, r0, m441, 'mqtt_client_cpp/topic2_1', ... (7 bytes))
> 1554220655: Sending PUBLISH to subscribe (d0, q1, r0, m442, 'mqtt_client_cpp/topic2_1', ... (7 bytes))
> 1554220655: Sending PUBLISH to subscribe (d0, q1, r0, m443, 'mqtt_client_cpp/topic2_1', ... (7 bytes))
> 1554220655: Sending PUBLISH to subscribe (d0, q1, r0, m444, 'mqtt_client_cpp/topic2_1', ... (7 bytes))
> 1554220655: Sending PUBLISH to subscribe (d0, q1, r0, m445, 'mqtt_client_cpp/topic2_1', ... (7 bytes))
> 1554220655: Sending PUBLISH to subscribe (d0, q1, r0, m446, 'mqtt_client_cpp/topic2_1', ... (7 bytes))
> 1554220655: Sending PUBLISH to subscribe (d0, q1, r0, m447, 'mqtt_client_cpp/topic2_1', ... (7 bytes))
> 1554220655: Sending PUBLISH to subscribe (d0, q1, r0, m448, 'mqtt_client_cpp/topic2_1', ... (7 bytes))
> 1554220655: Sending PUBLISH to subscribe (d0, q1, r0, m449, 'mqtt_client_cpp/topic2_1', ... (7 bytes))
> 1554220655: Sending PUBLISH to subscribe (d0, q1, r0, m450, 'mqtt_client_cpp/topic2_1', ... (7 bytes))
> 1554220655: Sending PUBLISH to subscribe (d0, q1, r0, m451, 'mqtt_client_cpp/topic2_1', ... (7 bytes))
> 1554220655: Sending PUBLISH to subscribe (d0, q1, r0, m452, 'mqtt_client_cpp/topic2_1', ... (7 bytes))
> 1554220655: Sending PUBLISH to subscribe (d0, q1, r0, m453, 'mqtt_client_cpp/topic2_1', ... (7 bytes))
> 1554220655: Sending PUBLISH to subscribe (d0, q1, r0, m454, 'mqtt_client_cpp/topic2_1', ... (7 bytes))
> 1554220655: Sending PUBLISH to subscribe (d0, q1, r0, m455, 'mqtt_client_cpp/topic2_1', ... (7 bytes))
> 1554220655: Received SUBSCRIBE from subscribe
> 1554220655: 	mqtt_client_cpp/topic2_1 (QoS 1)
> 1554220655: subscribe 1 mqtt_client_cpp/topic2_1
> 1554220655: Sending SUBACK to subscribe
> 1554220655: Sending PUBLISH to subscribe (d0, q1, r0, m456, 'mqtt_client_cpp/topic2_1', ... (7 bytes))
> 1554220655: Socket error on client subscribe, disconnecting.

application log:

> [marcel@elfin-behlau build]$ ./example/subscribe localhost 8883 /tmp/cert.pem
> Connack handler called
> Clean Session: true
> Connack Return Code: accepted
> publish received. dup: false pos: at_least_once retain: false
> packet_id: 437
> topic_name: mqtt_client_cpp/topic2_1 contents: test2_1
> publish received. dup: false pos: at_least_once retain: false
> packet_id: 438
> topic_name: mqtt_client_cpp/topic2_1 contents: test2_1
> publish received. dup: false pos: at_least_once retain: false
> packet_id: 439
> topic_name: mqtt_client_cpp/topic2_1 contents: test2_1
> publish received. dup: false pos: at_least_once retain: false
> packet_id: 440
> topic_name: mqtt_client_cpp/topic2_1 contents: test2_1
> publish received. dup: false pos: at_least_once retain: false
> packet_id: 441
> topic_name: mqtt_client_cpp/topic2_1 contents: test2_1
> publish received. dup: false pos: at_least_once retain: false
> packet_id: 442
> topic_name: mqtt_client_cpp/topic2_1 contents: test2_1
> publish received. dup: false pos: at_least_once retain: false
> packet_id: 443
> topic_name: mqtt_client_cpp/topic2_1 contents: test2_1
> publish received. dup: false pos: at_least_once retain: false
> packet_id: 444
> topic_name: mqtt_client_cpp/topic2_1 contents: test2_1
> publish received. dup: false pos: at_least_once retain: false
> packet_id: 445
> topic_name: mqtt_client_cpp/topic2_1 contents: test2_1
> publish received. dup: false pos: at_least_once retain: false
> packet_id: 446
> topic_name: mqtt_client_cpp/topic2_1 contents: test2_1
> publish received. dup: false pos: at_least_once retain: false
> packet_id: 447
> topic_name: mqtt_client_cpp/topic2_1 contents: test2_1
> publish received. dup: false pos: at_least_once retain: false
> packet_id: 448
> topic_name: mqtt_client_cpp/topic2_1 contents: test2_1
> publish received. dup: false pos: at_least_once retain: false
> packet_id: 449
> topic_name: mqtt_client_cpp/topic2_1 contents: test2_1
> publish received. dup: false pos: at_least_once retain: false
> packet_id: 450
> topic_name: mqtt_client_cpp/topic2_1 contents: test2_1
> publish received. dup: false pos: at_least_once retain: false
> packet_id: 451
> topic_name: mqtt_client_cpp/topic2_1 contents: test2_1
> publish received. dup: false pos: at_least_once retain: false
> packet_id: 452
> topic_name: mqtt_client_cpp/topic2_1 contents: test2_1
> publish received. dup: false pos: at_least_once retain: false
> packet_id: 453
> topic_name: mqtt_client_cpp/topic2_1 contents: test2_1
> publish received. dup: false pos: at_least_once retain: false
> packet_id: 454
> topic_name: mqtt_client_cpp/topic2_1 contents: test2_1
> publish received. dup: false pos: at_least_once retain: false
> packet_id: 455
> topic_name: mqtt_client_cpp/topic2_1 contents: test2_1
> publish received. dup: false pos: at_least_once retain: false
> packet_id: 456
> topic_name: mqtt_client_cpp/topic2_1 contents: test2_1
> [marcel@elfin-behlau build]$ echo $?
> 0

I'm not sure, if this problem is affected by mosquitto, mqtt_cpp or openssl. Since it's only occurs on tls clients, i can't use tcpdump to check the transmitted data and haven't any other idea, how to further narrow down the problem. Some ideas?

**Comment by marcel-behlau-elfin** [comment]
wireshark allows to decode the encrypted traffic. The is showing, the the problem is affected by the client and not by the broker.

mosquitto log:

> Sending PUBLISH to subscribe (d0, q1, r0, m19, 'mqtt_client_cpp/topic2_1', ... (7 bytes))
> Sending PUBLISH to subscribe (d0, q1, r0, m20, 'mqtt_client_cpp/topic2_1', ... (7 bytes))
> Received SUBSCRIBE from subscribe
>  	mqtt_client_cpp/topic2_1 (QoS 1)
> subscribe 1 mqtt_client_cpp/topic2_1
> Sending SUBACK to subscribe
> Client subscribe sent topic with invalid UTF-8, disconnecting.
> Socket error on client subscribe, disconnecting.

wireshark log:

> "19","0.100674","192.168.2.101","192.168.2.101","MQTT","1063","Publish Message (id=28528) [@][TLS segment of a reassembled PDU]"

> 0000   00 00 00 00 00 00 00 00 00 00 00 00 08 00 45 00   ..............E.
> 0010   04 19 e6 a7 40 00 40 06 ca 1c c0 a8 02 65 c0 a8   ....@.@......e..
> 0020   02 65 9d be 22 b3 cd a2 da 2b 89 f2 0b 88 80 18   .e.."....+......
> 0030   02 00 8a 26 00 00 01 01 08 0a 03 6d 02 12 03 6d   ...&.......m...m
> 0040   02 12 17 03 03 00 1a 8c d8 91 04 ed 55 f5 68 a2   ............U.h.
> 0050   da 1e 1f a4 93 f3 b3 74 e0 41 97 5b 9c 00 43 21   .......t.A.[..C!
> 0060   7a 17 03 03 00 1a 8c d8 91 04 ed 55 f5 69 ef 26   z..........U.i.&
> 0070   2f 6b e8 73 d4 bc 6f 30 f6 f0 26 9f ce f9 92 51   /k.s..o0..&....Q
> 0080   17 03 03 00 30 8c d8 91 04 ed 55 f5 6a 64 8d c9   ....0.....U.jd..
> 0090   c5 a0 98 93 36 44 d0 d8 c0 71 3b 9f 6e fa 8e ce   ....6D...q;.n...
> 00a0   83 a8 b0 50 8f bf fc 2b 21 44 88 7b 2f 99 12 25   ...P...+!D.{/..%
> 00b0   6c fa e6 b2 7d 17 03 03 00 19 8c d8 91 04 ed 55   l...}..........U
> 00c0   f5 6b 08 5a 82 88 2b d6 06 d8 9b a5 fd 41 3f 27   .k.Z..+......A?'
> 00d0   d8 46 10 17 03 03 00 19 8c d8 91 04 ed 55 f5 6c   .F...........U.l
> 00e0   dd 15 46 df f0 71 60 64 cd ae ea 49 2c 62 31 14   ..F..q`d...I,b1.
> 00f0   09 17 03 03 00 19 8c d8 91 04 ed 55 f5 6d 9c b5   ...........U.m..
> 0100   30 9e de 4c 1c 71 30 d3 49 00 b5 66 fb 6c 74 17   0..L.q0.I..f.lt.
> 0110   03 03 00 1a 8c d8 91 04 ed 55 f5 6e e6 73 07 37   .........U.n.s.7
> 0120   44 2f 77 d8 49 21 8b 0f 1f 42 a0 07 72 b7 17 03   D/w.I!...B..r...
> 0130   03 00 1c 8c d8 91 04 ed 55 f5 6f a9 87 07 d4 84   ........U.o.....
> 0140   25 90 19 89 6e cb 46 25 8e 6b a6 e8 aa 87 a9 17   %...n.F%.k......
> 0150   03 03 00 1d 8c d8 91 04 ed 55 f5 70 36 11 4c 8d   .........U.p6.L.
> 0160   54 c4 55 c1 f7 c6 f2 d0 b8 93 59 17 05 63 f2 b1   T.U.......Y..c..
> 0170   91 17 03 03 00 1a 8c d8 91 04 ed 55 f5 71 30 88   ...........U.q0.
> 0180   30 e0 c3 88 32 4b 54 a1 2a 90 d2 76 f9 5e 85 a8   0...2KT.*..v.^..
> 0190   17 03 03 00 1f 8c d8 91 04 ed 55 f5 72 88 c5 87   ..........U.r...
> 01a0   d8 15 99 1e 48 d8 b0 9c a8 84 3d 08 59 74 0f 80   ....H.....=.Yt..
> 01b0   62 a1 7e c8 17 03 03 00 1c 8c d8 91 04 ed 55 f5   b.~...........U.
> 01c0   73 8d e4 98 88 f1 f2 5e f4 a0 e4 4f 24 76 f5 c8   s......^...O$v..
> 01d0   6f 15 a1 ee af 17 03 03 00 1c 8c d8 91 04 ed 55   o..............U
> 01e0   f5 74 0d 72 8b db ab 86 66 e2 46 cf f7 20 d4 66   .t.r....f.F.. .f
> 01f0   3a 65 07 f1 1f 05 17 03 03 00 1c 8c d8 91 04 ed   :e..............
> 0200   55 f5 75 8e eb 28 3c a1 bf 9f d0 28 39 e3 7c 4a   U.u..(<....(9.|J
> 0210   63 e9 a8 ee c0 d1 82 17 03 03 00 1c 8c d8 91 04   c...............
> 0220   ed 55 f5 76 8f 57 74 57 93 00 60 9a 08 01 13 c2   .U.v.WtW..`.....
> 0230   cb b8 f2 e8 86 5b 0a 98 17 03 03 00 1c 8c d8 91   .....[..........
> 0240   04 ed 55 f5 77 e9 0d 10 79 9e 25 a7 76 b6 49 63   ..U.w...y.%.v.Ic
> 0250   6b a7 bf a8 fb 73 e5 1c 0b 17 03 03 00 1c 8c d8   k....s..........
> 0260   91 04 ed 55 f5 78 82 69 fe a7 ce a4 fe e0 5c 91   ...U.x.i......\.
> 0270   52 35 1c f9 36 f7 de c5 31 13 17 03 03 00 1c 8c   R5..6...1.......
> 0280   d8 91 04 ed 55 f5 79 79 96 e2 1a b6 fa 6e a5 10   ....U.yy.....n..
> 0290   39 60 ae 4f 0e 36 d6 9b 2e d1 47 17 03 03 00 1c   9`.O.6....G.....
> 02a0   8c d8 91 04 ed 55 f5 7a a9 8f 1c 12 b2 e9 82 c1   .....U.z........
> 02b0   ed 9f 51 a3 77 29 ca 5f cc ef b0 f1 17 03 03 00   ..Q.w)._........
> 02c0   1c 8c d8 91 04 ed 55 f5 7b c5 d0 70 01 5a 8e 0d   ......U.{..p.Z..
> 02d0   75 b5 01 df 55 2f 46 0f 83 c3 9c 0c 65 17 03 03   u...U/F.....e...
> 02e0   00 1c 8c d8 91 04 ed 55 f5 7c 89 5c f4 9d 7b 03   .......U.|.\..{.
> 02f0   07 c0 d4 e6 58 89 f1 a5 de 20 66 cb 96 ac 17 03   ....X.... f.....
> 0300   03 00 1c 8c d8 91 04 ed 55 f5 7d 36 11 b5 85 a0   ........U.}6....
> 0310   41 77 b4 f9 6d e6 04 e5 cd fa 9a 9f 8f b4 06 17   Aw..m...........
> 0320   03 03 00 1c 8c d8 91 04 ed 55 f5 7e 20 d8 b5 4f   .........U.~ ..O
> 0330   49 47 9c 7d 87 fb 01 5d 92 ad c9 87 eb b6 5a 94   IG.}...]......Z.
> 0340   17 03 03 00 1c 8c d8 91 04 ed 55 f5 7f fb c1 48   ..........U....H
> 0350   ce 45 6e ae ab 83 13 ae 4c a1 37 ef 41 1e 66 ce   .En.....L.7.A.f.
> 0360   15 17 03 03 00 1c 8c d8 91 04 ed 55 f5 80 25 84   ...........U..%.
> 0370   8d d9 c2 b6 85 99 c8 7b 59 9e 94 93 a7 51 00 93   .......{Y....Q..
> 0380   8a 9e 17 03 03 00 1c 8c d8 91 04 ed 55 f5 81 77   ............U..w
> 0390   e3 c8 39 8c f9 95 46 70 d4 0a 46 08 66 bf 5e ba   ..9...Fp..F.f.^.
> 03a0   a5 3d 1b 17 03 03 00 1c 8c d8 91 04 ed 55 f5 82   .=...........U..
> 03b0   9d 6b 09 13 f3 40 57 96 8d f9 e9 98 59 6e e3 6f   .k...@W.....Yn.o
> 03c0   68 7b aa ee 17 03 03 00 1c 8c d8 91 04 ed 55 f5   h{............U.
> 03d0   83 63 7a 9a 77 5e 97 2f c2 54 4b 5c 52 af c6 c4   .cz.w^./.TK\R...
> 03e0   39 b5 02 0c a3 17 03 03 00 1c 8c d8 91 04 ed 55   9..............U
> 03f0   f5 84 9a 84 a5 e1 9e da b5 f8 b3 f5 37 e0 7d c7   ............7.}.
> 0400   b5 f3 ca 6e b7 90 17 03 03 00 1c 8c d8 91 04 ed   ...n............
> 0410   55 f5 85 f2 ba ab 37 4e 71 0a 87 1c 6c b6 39 1a   U.....7Nq...l.9.
> 0420   e1 24 fa 8d c4 37 b0                              .$...7.
> 

> Frame 19: 1063 bytes on wire (8504 bits), 1063 bytes captured (8504 bits)
>     Encapsulation type: Ethernet (1)
>     Arrival Time: Apr  3, 2019 13:12:27.591289000 CEST
>     [Time shift for this packet: 0.000000000 seconds]
>     Epoch Time: 1554289947.591289000 seconds
>     [Time delta from previous captured frame: 0.000041000 seconds]
>     [Time delta from previous displayed frame: 0.000041000 seconds]
>     [Time since reference or first frame: 0.100674000 seconds]
>     Frame Number: 19
>     Frame Length: 1063 bytes (8504 bits)
>     Capture Length: 1063 bytes (8504 bits)
>     [Frame is marked: False]
>     [Frame is ignored: False]
>     [Protocols in frame: eth:ethertype:ip:tcp:tls:mqtt:mqtt]
>     [Coloring Rule Name: TCP]
>     [Coloring Rule String: tcp]
> Ethernet II, Src: 00:00:00_00:00:00 (00:00:00:00:00:00), Dst: 00:00:00_00:00:00 (00:00:00:00:00:00)
>     Destination: 00:00:00_00:00:00 (00:00:00:00:00:00)
>         Address: 00:00:00_00:00:00 (00:00:00:00:00:00)
>         .... ..0. .... .... .... .... = LG bit: Globally unique address (factory default)
>         .... ...0 .... .... .... .... = IG bit: Individual address (unicast)
>     Source: 00:00:00_00:00:00 (00:00:00:00:00:00)
>         Address: 00:00:00_00:00:00 (00:00:00:00:00:00)
>         .... ..0. .... .... .... .... = LG bit: Globally unique address (factory default)
>         .... ...0 .... .... .... .... = IG bit: Individual address (unicast)
>     Type: IPv4 (0x0800)
> Internet Protocol Version 4, Src: 192.168.2.101, Dst: 192.168.2.101
>     0100 .... = Version: 4
>     .... 0101 = Header Length: 20 bytes (5)
>     Differentiated Services Field: 0x00 (DSCP: CS0, ECN: Not-ECT)
>         0000 00.. = Differentiated Services Codepoint: Default (0)
>         .... ..00 = Explicit Congestion Notification: Not ECN-Capable Transport (0)
>     Total Length: 1049
>     Identification: 0xe6a7 (59047)
>     Flags: 0x4000, Don't fragment
>         0... .... .... .... = Reserved bit: Not set
>         .1.. .... .... .... = Don't fragment: Set
>         ..0. .... .... .... = More fragments: Not set
>         ...0 0000 0000 0000 = Fragment offset: 0
>     Time to live: 64
>     Protocol: TCP (6)
>     Header checksum: 0xca1c [validation disabled]
>     [Header checksum status: Unverified]
>     Source: 192.168.2.101
>     Destination: 192.168.2.101
> Transmission Control Protocol, Src Port: 40382, Dst Port: 8883, Seq: 574, Ack: 3831, Len: 997
>     Source Port: 40382
>     Destination Port: 8883
>     [Stream index: 0]
>     [TCP Segment Len: 997]
>     Sequence number: 574    (relative sequence number)
>     [Next sequence number: 1571    (relative sequence number)]
>     Acknowledgment number: 3831    (relative ack number)
>     1000 .... = Header Length: 32 bytes (8)
>     Flags: 0x018 (PSH, ACK)
>         000. .... .... = Reserved: Not set
>         ...0 .... .... = Nonce: Not set
>         .... 0... .... = Congestion Window Reduced (CWR): Not set
>         .... .0.. .... = ECN-Echo: Not set
>         .... ..0. .... = Urgent: Not set
>         .... ...1 .... = Acknowledgment: Set
>         .... .... 1... = Push: Set
>         .... .... .0.. = Reset: Not set
>         .... .... ..0. = Syn: Not set
>         .... .... ...0 = Fin: Not set
>         [TCP Flags: ·······AP···]
>     Window size value: 512
>     [Calculated window size: 65536]
>     [Window size scaling factor: 128]
>     Checksum: 0x8a26 [unverified]
>     [Checksum Status: Unverified]
>     Urgent pointer: 0
>     Options: (12 bytes), No-Operation (NOP), No-Operation (NOP), Timestamps
>         TCP Option - No-Operation (NOP)
>             Kind: No-Operation (1)
>         TCP Option - No-Operation (NOP)
>             Kind: No-Operation (1)
>         TCP Option - Timestamps: TSval 57475602, TSecr 57475602
>             Kind: Time Stamp Option (8)
>             Length: 10
>             Timestamp value: 57475602
>             Timestamp echo reply: 57475602
>     [SEQ/ACK analysis]
>         [iRTT: 0.000052000 seconds]
>         [Bytes in flight: 997]
>         [Bytes sent since last PSH flag: 997]
>     [Timestamps]
>         [Time since first frame in this TCP stream: 0.100674000 seconds]
>         [Time since previous frame in this TCP stream: 0.000041000 seconds]
>     TCP payload (997 bytes)
>     [PDU Size: 31]
>     [PDU Size: 18]
> Transport Layer Security
>     TLSv1.2 Record Layer: Application Data Protocol: mqtt
>         Content Type: Application Data (23)
>         Version: TLS 1.2 (0x0303)
>         Length: 26
>         Encrypted Application Data: 8cd89104ed55f568a2da1e1fa493f3b374e041975b9c0043…
>     [Reassembled PDU in frame: 19]
>     TLS segment data (2 bytes)
>     TLSv1.2 Record Layer: Application Data Protocol: mqtt
>         Content Type: Application Data (23)
>         Version: TLS 1.2 (0x0303)
>         Length: 26
>         Encrypted Application Data: 8cd89104ed55f569ef262f6be873d4bc6f30f6f0269fcef9…
>     [Reassembled PDU in frame: 19]
>     TLS segment data (2 bytes)
>     TLSv1.2 Record Layer: Application Data Protocol: mqtt
>         Content Type: Application Data (23)
>         Version: TLS 1.2 (0x0303)
>         Length: 48
>         Encrypted Application Data: 8cd89104ed55f56a648dc9c5a098933644d0d8c0713b9f6e…
>     [Reassembled PDU in frame: 19]
>     TLS segment data (24 bytes)
>     TLSv1.2 Record Layer: Application Data Protocol: mqtt
>         Content Type: Application Data (23)
>         Version: TLS 1.2 (0x0303)
>         Length: 25
>         Encrypted Application Data: 8cd89104ed55f56b085a82882bd606d89ba5fd413f27d846…
>     TLS segment data (1 byte)
>     TLSv1.2 Record Layer: Application Data Protocol: mqtt
>         Content Type: Application Data (23)
>         Version: TLS 1.2 (0x0303)
>         Length: 25
>         Encrypted Application Data: 8cd89104ed55f56cdd1546dff0716064cdaeea492c623114…
>     TLS segment data (1 byte)
>     TLSv1.2 Record Layer: Application Data Protocol: mqtt
>         Content Type: Application Data (23)
>         Version: TLS 1.2 (0x0303)
>         Length: 25
>         Encrypted Application Data: 8cd89104ed55f56d9cb5309ede4c1c7130d34900b566fb6c…
>     [Reassembled PDU in frame: 19]
>     TLS segment data (1 byte)
>     TLSv1.2 Record Layer: Application Data Protocol: mqtt
>         Content Type: Application Data (23)
>         Version: TLS 1.2 (0x0303)
>         Length: 26
>         Encrypted Application Data: 8cd89104ed55f56ee6730737442f77d849218b0f1f42a007…
>     [Reassembled PDU in frame: 19]
>     TLS segment data (2 bytes)
>     TLSv1.2 Record Layer: Application Data Protocol: mqtt
>         Content Type: Application Data (23)
>         Version: TLS 1.2 (0x0303)
>         Length: 28
>         Encrypted Application Data: 8cd89104ed55f56fa98707d484259019896ecb46258e6ba6…
>     [Reassembled PDU in frame: 19]
>     TLS segment data (4 bytes)
>     TLSv1.2 Record Layer: Application Data Protocol: mqtt
>         Content Type: Application Data (23)
>         Version: TLS 1.2 (0x0303)
>         Length: 29
>         Encrypted Application Data: 8cd89104ed55f57036114c8d54c455c1f7c6f2d0b8935917…
>     [Reassembled PDU in frame: 19]
>     TLS segment data (5 bytes)
>     TLSv1.2 Record Layer: Application Data Protocol: mqtt
>         Content Type: Application Data (23)
>         Version: TLS 1.2 (0x0303)
>         Length: 26
>         Encrypted Application Data: 8cd89104ed55f571308830e0c388324b54a12a90d276f95e…
>     [Reassembled PDU in frame: 19]
>     TLS segment data (2 bytes)
>     TLSv1.2 Record Layer: Application Data Protocol: mqtt
>         Content Type: Application Data (23)
>         Version: TLS 1.2 (0x0303)
>         Length: 31
>         Encrypted Application Data: 8cd89104ed55f57288c587d815991e48d8b09ca8843d0859…
>     TLS segment data (7 bytes)
>     TLS segment data (4 bytes)
>     TLSv1.2 Record Layer: Application Data Protocol: mqtt
>         Content Type: Application Data (23)
>         Version: TLS 1.2 (0x0303)
>         Length: 28
>         Encrypted Application Data: 8cd89104ed55f5738de49888f1f25ef4a0e44f2476f5c86f…
>     TLS segment data (4 bytes)
>     TLSv1.2 Record Layer: Application Data Protocol: mqtt
>         Content Type: Application Data (23)
>         Version: TLS 1.2 (0x0303)
>         Length: 28
>         Encrypted Application Data: 8cd89104ed55f5740d728bdbab8666e246cff720d4663a65…
>     TLS segment data (4 bytes)
>     TLSv1.2 Record Layer: Application Data Protocol: mqtt
>         Content Type: Application Data (23)
>         Version: TLS 1.2 (0x0303)
>         Length: 28
>         Encrypted Application Data: 8cd89104ed55f5758eeb283ca1bf9fd02839e37c4a63e9a8…
>     TLS segment data (4 bytes)
>     TLSv1.2 Record Layer: Application Data Protocol: mqtt
>         Content Type: Application Data (23)
>         Version: TLS 1.2 (0x0303)
>         Length: 28
>         Encrypted Application Data: 8cd89104ed55f5768f5774579300609a080113c2cbb8f2e8…
>     TLS segment data (4 bytes)
>     TLSv1.2 Record Layer: Application Data Protocol: mqtt
>         Content Type: Application Data (23)
>         Version: TLS 1.2 (0x0303)
>         Length: 28
>         Encrypted Application Data: 8cd89104ed55f577e90d10799e25a776b649636ba7bfa8fb…
>     TLS segment data (4 bytes)
>     TLSv1.2 Record Layer: Application Data Protocol: mqtt
>         Content Type: Application Data (23)
>         Version: TLS 1.2 (0x0303)
>         Length: 28
>         Encrypted Application Data: 8cd89104ed55f5788269fea7cea4fee05c9152351cf936f7…
>     TLS segment data (4 bytes)
>     TLSv1.2 Record Layer: Application Data Protocol: mqtt
>         Content Type: Application Data (23)
>         Version: TLS 1.2 (0x0303)
>         Length: 28
>         Encrypted Application Data: 8cd89104ed55f5797996e21ab6fa6ea5103960ae4f0e36d6…
>     TLS segment data (4 bytes)
>     TLSv1.2 Record Layer: Application Data Protocol: mqtt
>         Content Type: Application Data (23)
>         Version: TLS 1.2 (0x0303)
>         Length: 28
>         Encrypted Application Data: 8cd89104ed55f57aa98f1c12b2e982c1ed9f51a37729ca5f…
>     TLS segment data (4 bytes)
>     TLSv1.2 Record Layer: Application Data Protocol: mqtt
>         Content Type: Application Data (23)
>         Version: TLS 1.2 (0x0303)
>         Length: 28
>         Encrypted Application Data: 8cd89104ed55f57bc5d070015a8e0d75b501df552f460f83…
>     TLS segment data (4 bytes)
>     TLSv1.2 Record Layer: Application Data Protocol: mqtt
>         Content Type: Application Data (23)
>         Version: TLS 1.2 (0x0303)
>         Length: 28
>         Encrypted Application Data: 8cd89104ed55f57c895cf49d7b0307c0d4e65889f1a5de20…
>     TLS segment data (4 bytes)
>     TLSv1.2 Record Layer: Application Data Protocol: mqtt
>         Content Type: Application Data (23)
>         Version: TLS 1.2 (0x0303)
>         Length: 28
>         Encrypted Application Data: 8cd89104ed55f57d3611b585a04177b4f96de604e5cdfa9a…
>     TLS segment data (4 bytes)
>     TLSv1.2 Record Layer: Application Data Protocol: mqtt
>         Content Type: Application Data (23)
>         Version: TLS 1.2 (0x0303)
>         Length: 28
>         Encrypted Application Data: 8cd89104ed55f57e20d8b54f49479c7d87fb015d92adc987…
>     TLS segment data (4 bytes)
>     TLSv1.2 Record Layer: Application Data Protocol: mqtt
>         Content Type: Application Data (23)
>         Version: TLS 1.2 (0x0303)
>         Length: 28
>         Encrypted Application Data: 8cd89104ed55f57ffbc148ce456eaeab8313ae4ca137ef41…
>     TLS segment data (4 bytes)
>     TLSv1.2 Record Layer: Application Data Protocol: mqtt
>         Content Type: Application Data (23)
>         Version: TLS 1.2 (0x0303)
>         Length: 28
>         Encrypted Application Data: 8cd89104ed55f58025848dd9c2b68599c87b599e9493a751…
>     TLS segment data (4 bytes)
>     TLSv1.2 Record Layer: Application Data Protocol: mqtt
>         Content Type: Application Data (23)
>         Version: TLS 1.2 (0x0303)
>         Length: 28
>         Encrypted Application Data: 8cd89104ed55f58177e3c8398cf9954670d40a460866bf5e…
>     TLS segment data (4 bytes)
>     TLSv1.2 Record Layer: Application Data Protocol: mqtt
>         Content Type: Application Data (23)
>         Version: TLS 1.2 (0x0303)
>         Length: 28
>         Encrypted Application Data: 8cd89104ed55f5829d6b0913f34057968df9e998596ee36f…
>     TLS segment data (4 bytes)
>     TLSv1.2 Record Layer: Application Data Protocol: mqtt
>         Content Type: Application Data (23)
>         Version: TLS 1.2 (0x0303)
>         Length: 28
>         Encrypted Application Data: 8cd89104ed55f583637a9a775e972fc2544b5c52afc6c439…
>     TLS segment data (4 bytes)
>     TLSv1.2 Record Layer: Application Data Protocol: mqtt
>         Content Type: Application Data (23)
>         Version: TLS 1.2 (0x0303)
>         Length: 28
>         Encrypted Application Data: 8cd89104ed55f5849a84a5e19edab5f8b3f537e07dc7b5f3…
>     TLS segment data (4 bytes)
>     TLSv1.2 Record Layer: Application Data Protocol: mqtt
>         Content Type: Application Data (23)
>         Version: TLS 1.2 (0x0303)
>         Length: 28
>         Encrypted Application Data: 8cd89104ed55f585f2baab374e710a871c6cb6391ae124fa…
>     TLS segment data (4 bytes)
> [7 Reassembled TLS segments (18 bytes): #19(1), #19(1), #19(2), #19(4), #19(5), #19(2), #19(3)]
>     [Frame: 19, payload: 0-0 (1 byte)]
>     [Frame: 19, payload: 1-1 (1 byte)]
>     [Frame: 19, payload: 2-3 (2 bytes)]
>     [Frame: 19, payload: 4-7 (4 bytes)]
>     [Frame: 19, payload: 8-12 (5 bytes)]
>     [Frame: 19, payload: 13-14 (2 bytes)]
>     [Frame: 19, payload: 15-17 (3 bytes)]
>     [Segment count: 7]
>     [Reassembled PDU length: 18]
>     [Reassembled PDU data: 3210000540020001746f7069630002706179]
> [6 Reassembled TLS segments (31 bytes): #15(1), #17(1), #19(2), #19(2), #19(24), #19(1)]
>     [Frame: 15, payload: 0-0 (1 byte)]
>     [Frame: 17, payload: 1-1 (1 byte)]
>     [Frame: 19, payload: 2-3 (2 bytes)]
>     [Frame: 19, payload: 4-5 (2 bytes)]
>     [Frame: 19, payload: 6-29 (24 bytes)]
>     [Frame: 19, payload: 30-30 (1 byte)]
>     [Segment count: 6]
>     [Reassembled PDU length: 31]
>     [Reassembled PDU data: 821d000100186d7174745f636c69656e745f6370702f746f…]
> MQ Telemetry Transport Protocol, Subscribe Request
>     Header Flags: 0x82, Message Type: Subscribe Request
>         1000 .... = Message Type: Subscribe Request (8)
>         .... 0010 = Reserved: 2
>     Msg Len: 29
>     Message Identifier: 1
>     Topic Length: 24
>     Topic: mqtt_client_cpp/topic2_1
>     Requested QoS: At least once delivery (Acknowledged deliver) (1)
> MQ Telemetry Transport Protocol, Publish Message
>     Header Flags: 0x32, Message Type: Publish Message, QoS Level: At least once delivery (Acknowledged deliver)
>         0011 .... = Message Type: Publish Message (3)
>         .... 0... = DUP Flag: Not set
>         .... .01. = QoS Level: At least once delivery (Acknowledged deliver) (1)
>         .... ...0 = Retain: Not set
>     Msg Len: 16
>     Topic Length: 5
>     Topic: @\002
>         [Expert Info (Warning/Undecoded): Trailing stray characters]
>             [Trailing stray characters]
>             [Severity level: Warning]
>             [Group: Undecoded]
>     Message Identifier: 28528
>     Message: ic
>         [Expert Info (Warning/Undecoded): Trailing stray characters]
>             [Trailing stray characters]
>             [Severity level: Warning]
>             [Group: Undecoded]
>

**Comment by redboltz** [comment]
Thank you reporting the issue. Could you tell me the version (commit hash) of mqtt_cpp ?

**Comment by redboltz** [comment]
There was the problem that async_publish message is deallocated during transmission invalidly only if QoS is 1 or 2. That bug was discussed at #156, #157, #158, and fixed at #159. If you use older version than https://github.com/redboltz/mqtt_cpp/commit/1ee9bd91c54cc33329caf97fd98859619970cae8. Please update. It may fix the issue.

**Comment by marcel-behlau-elfin** [comment]
I used the current master 5b27d9c

**Comment by redboltz** [comment]
Thank you. I will take a look the issue.

**Comment by redboltz** [comment]
The are complicated information. Could you elaborate the problem? I don't understand what's wrong yet.

I need the following information:

1. Where is invalid packet created do you think? And why do you think so?

```
subscribe <----- mosquitto <------ publish
```

2. Where is capturing point? subscribe side or publish side?

**Comment by marcel-behlau-elfin** [comment]
In my capture test, client and broker running both on my host, connected by my loopback device. As capturing source, i also using my loopback device, so i'm able to see all messages between client and broker.

I added the complete decoded capture log for analyzing with wireshark --> https://github.com/marcel-behlau-elfin/mqtt_cpp/blob/async_publish_error/mqtt-decrypt.pcap

Within the log (entry 19)  you see that the client is sending a publish message for topic "@\002" and payload "ic". He should send Topic "topic" and payload "payload".

After this, the Broker closes the connection, (invalid UTF-8 for topic).

So the invalid packet is created within the client. I assume, it happens during passing the data to the openssl encryption or by the openssl encryption himself.

**Comment by redboltz** [comment]
Thank you!

I understand that

```
invalid packet is detected here
                          |
                          V
subscribe <----- mosquitto <------ publish
```

If I understand correctly, 

1. Start mosquitto with tls enabled
1. Compile examples
1. Start subscribe application and wait for subscribe
1. Stop subscribe application
1. Start publish application and wait for publish
1. Start subscribe application again

Step 3, 4, and 6 doesn't required. Just do step 5 again and again. Is that right?

**Comment by marcel-behlau-elfin** [comment]
Exactly, the invalid packet is detected from the mosquitto broker.

The critical step is step 6. 

Step 1-5 are necessary for creating queued messages. After first setting up, you have to repeat step 5 (to create new queued messages) and step 6, to reproduce the problem.

**Comment by redboltz** [comment]
I got confused. Why step 6 is needed?

We use two clients. `publish` and `subscribe`. Let's change their name to avoid confusion.

```
subscriber ---- mosquitto --- publisher
```

Now both subscriber and publisher are using mqtt_cpp.


Step a. subscriber connects to mosquitto.

```
subscriber ---- mosquitto
```

Step b. subscriber disconnects to mosquitto. I guess mosquitto creates on memory pseudo session for subscriber.

```
              (subscriber on memory)
subscriber --x- mosquitto
```

Step c. publisher publish tons of messages. I guess mosquitto validates UTF-8 and if it it is valid, then enque the message.

```
              (subscriber on memory)
subscriber --x- mosquitto --- publisher
                       <--- publish messages
```

```
              (subscriber on memory)
subscriber --x- mosquitto --- publisher
             queued messages
```

Step d. subscriber connect again, mosquitto publishes the queued messages to subscriber.

```
              (subscriber on memory)
subscriber ---- mosquitto --- publisher
         <--- publish queued messages
```

If mqtt_cpp on publisher sends invalid packet, mosquitto detects UTF-8 error on Step c and disconnect the publisher.
If Step 6 that corresponding to Step d is important, mosquitto publishes the message. It's mosquitto's problem.
Even if `queued message` is invalid, it is also mosquitto's problem because the message is already passed UTF-8 validation.

Am I missing something?

**Comment by redboltz** [comment]
I mean if publisher's mqtt_cpp sends invalid packet, I think that only step 5 is required. Step 6 is not affected publisher's sending packet in theory.

**Comment by redboltz** [comment]
Now I realized at the point of problem is `subscribe.cpp`'s `publish()`. I misunderstood that `publish.cpp` only publishes and `subscribe.cpp` only subscribes, but `subscribe.cpp` also publishes.

**Comment by redboltz** [comment]
I reproduced the issue. In order to debug deeply, I will write the code that reproduces the problem by stand alone for debug. When I would finish to write it, I would ask you to test the program.

**Comment by redboltz** [comment]
I updated `subscribe.cpp` a little. I added one argument that switches sending `subscribe` packet or not.

```cpp
// Copyright Takatoshi Kondo 2015
//
// Distributed under the Boost Software License, Version 1.0.
// (See accompanying file LICENSE_1_0.txt or copy at
// http://www.boost.org/LICENSE_1_0.txt)

#include <iostream>
#include <iomanip>
#include <map>

#include <boost/lexical_cast.hpp>

#include <mqtt_client_cpp.hpp>
#include <mqtt/optional.hpp>

int main(int argc, char** argv) {
    if (argc != 5) {
        std::cout << argv[0] << " host port cacert_file sub(0/1)" << std::endl;
        return -1;
    }

    boost::asio::io_service ios;

    std::string host = argv[1];
    std::uint16_t port = boost::lexical_cast<std::uint16_t>(argv[2]);
    std::string cacert = argv[3];

    std::size_t sub = boost::lexical_cast<std::size_t>(argv[4]);

    int count = 0;
    // Create TLS client
    auto c = mqtt::make_tls_client(ios, host, port);

    auto disconnect = [&] {
        //if (++count == 5) c->disconnect();
    };

    // Setup client
    c->set_client_id("subscribe");
    c->set_clean_session(false);
    c->set_ca_cert_file(cacert);

    // Setup handlers
    c->set_connack_handler(
        [&c, sub]
        (bool sp, std::uint8_t connack_return_code){
            std::cout << "Connack handler called" << std::endl;
            std::cout << "Clean Session: " << std::boolalpha << sp << std::endl;
            std::cout << "Connack Return Code: "
                      << mqtt::connect_return_code_to_str(connack_return_code) << std::endl;
            if (connack_return_code == mqtt::connect_return_code::accepted) {
                if (sub == 1) {
                    c->subscribe("mqtt_client_cpp/topic2_1", mqtt::qos::at_least_once);
                }
                c->async_publish("topic", "payload", 1, false);

            }
            return true;
        });

    c->set_publish_handler(
        [&]
        (std::uint8_t header,
         boost::optional<std::uint16_t> packet_id,
         std::string topic_name,
         std::string contents){
            std::cout << "publish received. "
                      << "dup: " << std::boolalpha << mqtt::publish::is_dup(header)
                      << " pos: " << mqtt::qos::to_str(mqtt::publish::get_qos(header))
                      << " retain: " << mqtt::publish::is_retain(header) << std::endl;
            if (packet_id)
                std::cout << "packet_id: " << *packet_id << std::endl;
            std::cout << "topic_name: " << topic_name << " contents: " << contents << std::endl;
            return true;
        });

    // Connect
    c->connect();

    ios.run();
}
```

１． Start mosquitto with tls enabled
１． Compile examples
１． Start subscribe application and wait for subscribe
１． Stop subscribe application with 1
１． Start publish application and wait for publish
１． Start subscribe application again with 0

The problem is disappeared. So I guess that sending `subscribe` packet process has some problem.

Here is Step 6 sequence.

```
subscriber                    mosquitto
    |       connect               |
    |---------------------------->|
    |                             |
    |       connack               |
    |<----------------------------|
    |                             |
    |       publish QoS1          |
    |<============================|
    |                             |
    |       puback                |
    |============================>|
    |                             |
    |       subscribe *1          |
    |---------------------------->|
    |                             |

===>  multiple messages
```

I guess that *1 subscribe could interrupt puback sending and that causes the problem. I will continue analyzing.

**Comment by redboltz** [comment]
It doesn't happen. sending subscribe timing is as follows:

```
subscriber                    mosquitto
    |       connect               |
    |---------------------------->|
    |                             |
    |       connack               |
    |<----------------------------|
    |                             |
    |       subscribe *1          |
    |---------------------------->|
    |                             |
    |       publish QoS1          |
    |<============================|
    |                             |
    |       puback                |
    |============================>|
    |                             |
    |                             |

```

**Comment by redboltz** [comment]
> Within the log (entry 19) you see that the client is sending a publish message for topic "@\002" and payload "ic". He should send Topic "topic" and payload "payload".
>
> After this, the Broker closes the connection, (invalid UTF-8 for topic).
>
> So the invalid packet is created within the client. I assume, it happens during passing the data to the openssl encryption or by the openssl encryption himself.

Could you tell me how to check captured packet? I read https://github.com/marcel-behlau-elfin/mqtt_cpp/blob/async_publish_error/mqtt-decrypt.pcap by wireshark. I can see No.1 to 22 packets. Then I select No.19 and check middle pane. I select Transmission Control Protocol, TCP payload (997 bytes).

And I copy it from right clieck copy menu.

Here is the packet:

```
0000   17 03 03 00 1a 8c d8 91 04 ed 55 f5 68 a2 da 1e
0010   1f a4 93 f3 b3 74 e0 41 97 5b 9c 00 43 21 7a 17
0020   03 03 00 1a 8c d8 91 04 ed 55 f5 69 ef 26 2f 6b
0030   e8 73 d4 bc 6f 30 f6 f0 26 9f ce f9 92 51 17 03
0040   03 00 30 8c d8 91 04 ed 55 f5 6a 64 8d c9 c5 a0
0050   98 93 36 44 d0 d8 c0 71 3b 9f 6e fa 8e ce 83 a8
0060   b0 50 8f bf fc 2b 21 44 88 7b 2f 99 12 25 6c fa
0070   e6 b2 7d 17 03 03 00 19 8c d8 91 04 ed 55 f5 6b
0080   08 5a 82 88 2b d6 06 d8 9b a5 fd 41 3f 27 d8 46
0090   10 17 03 03 00 19 8c d8 91 04 ed 55 f5 6c dd 15
00a0   46 df f0 71 60 64 cd ae ea 49 2c 62 31 14 09 17
00b0   03 03 00 19 8c d8 91 04 ed 55 f5 6d 9c b5 30 9e
00c0   de 4c 1c 71 30 d3 49 00 b5 66 fb 6c 74 17 03 03
00d0   00 1a 8c d8 91 04 ed 55 f5 6e e6 73 07 37 44 2f
00e0   77 d8 49 21 8b 0f 1f 42 a0 07 72 b7 17 03 03 00
00f0   1c 8c d8 91 04 ed 55 f5 6f a9 87 07 d4 84 25 90
0100   19 89 6e cb 46 25 8e 6b a6 e8 aa 87 a9 17 03 03
0110   00 1d 8c d8 91 04 ed 55 f5 70 36 11 4c 8d 54 c4
0120   55 c1 f7 c6 f2 d0 b8 93 59 17 05 63 f2 b1 91 17
0130   03 03 00 1a 8c d8 91 04 ed 55 f5 71 30 88 30 e0
0140   c3 88 32 4b 54 a1 2a 90 d2 76 f9 5e 85 a8 17 03
0150   03 00 1f 8c d8 91 04 ed 55 f5 72 88 c5 87 d8 15
0160   99 1e 48 d8 b0 9c a8 84 3d 08 59 74 0f 80 62 a1
0170   7e c8 17 03 03 00 1c 8c d8 91 04 ed 55 f5 73 8d
0180   e4 98 88 f1 f2 5e f4 a0 e4 4f 24 76 f5 c8 6f 15
0190   a1 ee af 17 03 03 00 1c 8c d8 91 04 ed 55 f5 74
01a0   0d 72 8b db ab 86 66 e2 46 cf f7 20 d4 66 3a 65
01b0   07 f1 1f 05 17 03 03 00 1c 8c d8 91 04 ed 55 f5
01c0   75 8e eb 28 3c a1 bf 9f d0 28 39 e3 7c 4a 63 e9
01d0   a8 ee c0 d1 82 17 03 03 00 1c 8c d8 91 04 ed 55
01e0   f5 76 8f 57 74 57 93 00 60 9a 08 01 13 c2 cb b8
01f0   f2 e8 86 5b 0a 98 17 03 03 00 1c 8c d8 91 04 ed
0200   55 f5 77 e9 0d 10 79 9e 25 a7 76 b6 49 63 6b a7
0210   bf a8 fb 73 e5 1c 0b 17 03 03 00 1c 8c d8 91 04
0220   ed 55 f5 78 82 69 fe a7 ce a4 fe e0 5c 91 52 35
0230   1c f9 36 f7 de c5 31 13 17 03 03 00 1c 8c d8 91
0240   04 ed 55 f5 79 79 96 e2 1a b6 fa 6e a5 10 39 60
0250   ae 4f 0e 36 d6 9b 2e d1 47 17 03 03 00 1c 8c d8
0260   91 04 ed 55 f5 7a a9 8f 1c 12 b2 e9 82 c1 ed 9f
0270   51 a3 77 29 ca 5f cc ef b0 f1 17 03 03 00 1c 8c
0280   d8 91 04 ed 55 f5 7b c5 d0 70 01 5a 8e 0d 75 b5
0290   01 df 55 2f 46 0f 83 c3 9c 0c 65 17 03 03 00 1c
02a0   8c d8 91 04 ed 55 f5 7c 89 5c f4 9d 7b 03 07 c0
02b0   d4 e6 58 89 f1 a5 de 20 66 cb 96 ac 17 03 03 00
02c0   1c 8c d8 91 04 ed 55 f5 7d 36 11 b5 85 a0 41 77
02d0   b4 f9 6d e6 04 e5 cd fa 9a 9f 8f b4 06 17 03 03
02e0   00 1c 8c d8 91 04 ed 55 f5 7e 20 d8 b5 4f 49 47
02f0   9c 7d 87 fb 01 5d 92 ad c9 87 eb b6 5a 94 17 03
0300   03 00 1c 8c d8 91 04 ed 55 f5 7f fb c1 48 ce 45
0310   6e ae ab 83 13 ae 4c a1 37 ef 41 1e 66 ce 15 17
0320   03 03 00 1c 8c d8 91 04 ed 55 f5 80 25 84 8d d9
0330   c2 b6 85 99 c8 7b 59 9e 94 93 a7 51 00 93 8a 9e
0340   17 03 03 00 1c 8c d8 91 04 ed 55 f5 81 77 e3 c8
0350   39 8c f9 95 46 70 d4 0a 46 08 66 bf 5e ba a5 3d
0360   1b 17 03 03 00 1c 8c d8 91 04 ed 55 f5 82 9d 6b
0370   09 13 f3 40 57 96 8d f9 e9 98 59 6e e3 6f 68 7b
0380   aa ee 17 03 03 00 1c 8c d8 91 04 ed 55 f5 83 63
0390   7a 9a 77 5e 97 2f c2 54 4b 5c 52 af c6 c4 39 b5
03a0   02 0c a3 17 03 03 00 1c 8c d8 91 04 ed 55 f5 84
03b0   9a 84 a5 e1 9e da b5 f8 b3 f5 37 e0 7d c7 b5 f3
03c0   ca 6e b7 90 17 03 03 00 1c 8c d8 91 04 ed 55 f5
03d0   85 f2 ba ab 37 4e 71 0a 87 1c 6c b6 39 1a e1 24
03e0   fa 8d c4 37 b0
```

http://docs.oasis-open.org/mqtt/mqtt/v3.1.1/os/mqtt-v3.1.1-os.html#_Toc398718038

The Fixed Header of the publish packet is `0b00110010` (no dup, QoS1, no retain). It's `0x32`.

```
0140   c3 88 32 4b 54 a1 2a 90 d2 76 f9 5e 85 a8 17 03
```

It is something different from you mentioned. Do I need some decryption ?

I have one more question.

> subscribe 1 mqtt_client_cpp/topic2_1
> Sending SUBACK to subscribe
> Client subscribe sent topic with invalid UTF-8, disconnecting.
> Socket error on client subscribe, disconnecting.

The mosquitto log indicates the invalid UTF-8 error is on subscribe, not publish. Is the subscribe packet sending correctly ?

**Comment by redboltz** [comment]
I capture the packet that reproduces the problem on my environment by my self. 

> wireshark allows to decode the encrypted traffic. The is showing, the the problem is affected by the client and not by the broker.

You mentioned above. I tried to decode but failed so far. I added server.key to wire shark. I read https://support.citrix.com/article/CTX116557.

I guess that protocol might use DHE.

> The Diffie Hellman (DHE) ciphers cannot be decrypted

I'm not sure how to check and disable (if it is set) DHE on mosquitto.

**Comment by redboltz** [comment]
During I'm stuck on wireshark, I tried a different approach. That is minimal broker that supports TLS connection.
 
https://github.com/redboltz/mqtt_cpp/tree/fix_196

I implemented the test broker for debug that support TLS.

1. copy test/certs/*.pem to example build directory.
2. `make broker subscribe publish`
3. `./broker` or run mosquitto
4. `subscribe 127.0.0.1 8883 cacert.pem 1`
5. Ctrl-C
6. `publish 127.0.0.1 8883 cacert.pem`
7. `subscribe 127.0.0.1 8883 cacert.pem 1`

At the step 3, if I run mosquitto, the problem is reproduced. But if I run `./broker`, the problem is not reproduced.

**Comment by redboltz** [comment]
I need helps to decrypt TLS message on wireshark.

I set `Edit -> Preference -> Protocol -> SSL -> RSA keys list` to `server.key.crt`. But the message is not decrypted. 

I read https://wiki.wireshark.org/SSL and tried "Example capture file", it decrypted successfully. 

I guess DH is the reason I can't decrypt. I tried to find a way to disable DH. But I did't find it. The next approach is using `(Pre)-Master-Secret log filename` on wireshark's TLS dialog. But I didn't find a way to output master secret log file.

**Comment by redboltz** [comment]
Is #200 outputting master secret log file? Thanks! I will try it.

**Comment by marcel-behlau-elfin** [comment]
Exactly, #200 will export the file. Unfortunately openssl isn't directly able to export the file, controlled by an environment variable.

My complete setup for ssl decryption look like this --> https://github.com/marcel-behlau-elfin/mqtt_cpp/blob/async_publish_error/wireshark_decrypt_config.png

If everything works, it shot look like this --> https://github.com/marcel-behlau-elfin/mqtt_cpp/blob/async_publish_error/wireshark_detail.png

**Comment by redboltz** [comment]
Now, I decrypted successfully! Thank you for your support.

**Comment by marcel-behlau-elfin** [comment]
Your welcome!

I assume, your broker is writing a tcp packet for every publish, mosquitto collects all publish messages and finally writing 1 big frame. This could be the reason, why your broker isn't able to reproduce the problem.

**Comment by redboltz** [comment]
> I assume, your broker is writing a tcp packet for every publish, mosquitto collects all publish messages and finally writing 1 big frame. This could be the reason, why your broker isn't able to reproduce the problem.

I just thinking the same thing. After mosquitto's concatenated publish frame  received, the client sends Subscribe packet and Publish packet as one frame. It's never happen connecting with my broker. 
I don't know about TLS framing mechanism. But mosquitto's big frame might be some trigger for mqtt_cpp send a concatenated frame. 
Hmm.... 

Anyway, I continue debugging.

**Comment by redboltz** [comment]
Here is my capture:

![td1](https://user-images.githubusercontent.com/275959/55540798-ad425c00-56fe-11e9-91a8-e38626768dfe.png)

Here is subscribe.cpp 's log:

```
Connack handler called
Clean Session: true
Connack Return Code: accepted
send_subscribe
publish received. dup: false pos: at_least_once retain: false
packet_id: 1
topic_name: mqtt_client_cpp/topic2_1 contents: test2_1
send_puback
publish received. dup: false pos: at_least_once retain: false
packet_id: 2
topic_name: mqtt_client_cpp/topic2_1 contents: test2_1
send_puback
write complete topic: topic Epoc Time:1554365440.63896879
publish received. dup: false pos: at_least_once retain: false
packet_id: 3
topic_name: mqtt_client_cpp/topic2_1 contents: test2_1
send_puback
publish received. dup: false pos: at_least_once retain: false
packet_id: 4
topic_name: mqtt_client_cpp/topic2_1 contents: test2_1
send_puback
publish received. dup: false pos: at_least_once retain: false
packet_id: 5
topic_name: mqtt_client_cpp/topic2_1 contents: test2_1
send_puback
publish received. dup: false pos: at_least_once retain: false
packet_id: 6
topic_name: mqtt_client_cpp/topic2_1 contents: test2_1
send_puback
publish received. dup: false pos: at_least_once retain: false
packet_id: 7
topic_name: mqtt_client_cpp/topic2_1 contents: test2_1
send_puback
publish received. dup: false pos: at_least_once retain: false
packet_id: 8
topic_name: mqtt_client_cpp/topic2_1 contents: test2_1
send_puback
publish received. dup: false pos: at_least_once retain: false
packet_id: 9
topic_name: mqtt_client_cpp/topic2_1 contents: test2_1
send_puback
publish received. dup: false pos: at_least_once retain: false
packet_id: 10
topic_name: mqtt_client_cpp/topic2_1 contents: test2_1
send_puback
publish received. dup: false pos: at_least_once retain: false
packet_id: 11
topic_name: mqtt_client_cpp/topic2_1 contents: test2_1
send_puback
publish received. dup: false pos: at_least_once retain: false
packet_id: 12
topic_name: mqtt_client_cpp/topic2_1 contents: test2_1
send_puback
publish received. dup: false pos: at_least_once retain: false
packet_id: 13
topic_name: mqtt_client_cpp/topic2_1 contents: test2_1
send_puback
publish received. dup: false pos: at_least_once retain: false
packet_id: 14
topic_name: mqtt_client_cpp/topic2_1 contents: test2_1
send_puback
publish received. dup: false pos: at_least_once retain: false
packet_id: 15
topic_name: mqtt_client_cpp/topic2_1 contents: test2_1
send_puback
publish received. dup: false pos: at_least_once retain: false
packet_id: 16
topic_name: mqtt_client_cpp/topic2_1 contents: test2_1
send_puback
publish received. dup: false pos: at_least_once retain: false
packet_id: 17
topic_name: mqtt_client_cpp/topic2_1 contents: test2_1
send_puback
publish received. dup: false pos: at_least_once retain: false
packet_id: 18
topic_name: mqtt_client_cpp/topic2_1 contents: test2_1
send_puback
publish received. dup: false pos: at_least_once retain: false
packet_id: 19
topic_name: mqtt_client_cpp/topic2_1 contents: test2_1
send_puback
publish received. dup: false pos: at_least_once retain: false
packet_id: 20
topic_name: mqtt_client_cpp/topic2_1 contents: test2_1
send_puback
lifetime over topic: topic Epoc Time:1554365440.105072497
```

The invalid message's Epoch Time is `1554365440.104687000`.

`lifetime over topic: topic Epoc Time:1554365440.105072497`

QoS1 message is kept by client until puback is received. This indicates that mqtt_cpp is keeping valid topic value on memory. The pointer of memory is passed to Boost.Asio.

The invalid packet has the value `topic` but `40 02 00 01` is inserted before `topic`.
mqtt_cpp cannot insert those bytes.

The vector to pass to Boost.Asio is created at
https://github.com/marcel-behlau-elfin/mqtt_cpp/blob/dca4a486042ba5aa2c5877a4c9099cc2b7983e85/include/mqtt/message.hpp#L551-L573

I also use clang address sanitizer to check invalid memory access. But it is not detected.


These facts indicates that the problem is likely caused by Boost.Asio or OpenSSL.
The next step is reporting the issue to Boost.Asio or OpenSSL.

In order to report the issue, I think that this program and mosquitto is too big. I think that we need to create minimal and complete code that reproduces the problem.

**Comment by redboltz** [comment]
I noticed that the problem is caused by mqtt_cpp.

http://docs.oasis-open.org/mqtt/mqtt/v3.1.1/os/mqtt-v3.1.1-os.html#_Toc398718043

The inserted packet `40 02 00 01` is puback.

`mqtt::endpoint` has the member variable `auto_pub_response_ (true)` and `auto_pub_response_async_ (false)`.  The boolean in the bracket means the default value.

That means when the client receives publish (QoS1) then sends puback automatically and it is synchronously.

See
https://github.com/marcel-behlau-elfin/mqtt_cpp/blob/dca4a486042ba5aa2c5877a4c9099cc2b7983e85/include/mqtt/endpoint.hpp#L79

Boost.Asio's async_write doesn't allow other write operation before write completion callback is called. So mqtt_cpp violate the rule.

```cpp
    c->set_ca_cert_file(cacert);
    c->set_auto_pub_response(true, true); // insert this line
```

When I add auto pub response setting, then the problem is disappeared.

**Comment by redboltz** [comment]
I think that mixing async and sync operation is dangerous.
I need to inform to users how to use safely.
I think that adding documents isn't enough. I don't consider deeply yet but some error reporting mechanism is required.

**Comment by redboltz** [comment]
Here is the current `mqtt::client` and `mqtt::endpoint` situation.

|During \ Next|sync|async|
|---|---|---|
|sync|never happen|never happen|
|async|dangerous*1|queued|

*1 expert user can handle async completion handler to avoid this situation even if mixing sync and async.

Users need to care whether sync or async API using. That includes auto_pub_response_async_.

It's pretty annoying for casual users.

My current idea is introducing `sync_client` and `async_client` for ordinary users.
`client` is keeping the current behavior. For expert user might want to mix async and sync call.  


Here is POC code:
https://wandbox.org/permlink/5CLQW6rvA9UjljeL

**Comment by redboltz** [comment]
## Conclusion

The problem happens `subscribe.cpp` uses the combination of `async_publish()` API call and implicit synchronous auto publish response mechanism invalidly. mqtt_cpp users needs to avoid the invalid combination. So this is `subscribe.cpp`'s problem.

However, the current mqtt_cpp's API is easy to misuse. It should be improved.

**Comment by marcel-behlau-elfin** [comment]
> *1 expert user can handle async completion handler to avoid this situation even if mixing sync and async.

> Users need to care whether sync or async API using. That includes auto_pub_response_async_.
> 
> It's pretty annoying for casual users.
> 
> My current idea is introducing sync_client and async_client for ordinary users.
> client is keeping the current behavior. For expert user might want to mix async and sync call.

Yeah, the interface should be changed. In my opinion, it should be hard, to use it, in a wrong way.

I'm not sure, if i like a sync_client and a async_client implementation. At the moment, mqtt_cpp is already providing a non tls and a tls client version, without implementing a common/generic interface. For an application, which didn't care about the specific kind of client implementation, this is annoying. Providing new client implementations, will blow up this situation.

**Comment by redboltz** [comment]
I added async_client and sync_client. See #208. It avoids misuse.

> Can you provide an example, what have to be implemented for this handler?

Please wait a moment.

**Comment by redboltz** [comment]
Here is the example code mixing async/sync operation by `client`. It is only for demonstrate purpose.
This code assumes that broker never violate MQTT protocol.

mix_async_sync.cpp

```cpp
#include <iostream>
#include <iomanip>
#include <map>

#include <boost/lexical_cast.hpp>

#include <mqtt_client_cpp.hpp>
#include <mqtt/optional.hpp>

int main(int argc, char** argv) {
    if (argc != 3) {
        std::cout << argv[0] << " host port" << std::endl;
        return -1;
    }

    boost::asio::io_service ios;

    // Create no TLS client
    auto c = mqtt::make_client(ios, argv[1], boost::lexical_cast<std::uint16_t>(argv[2]));
    using packet_id_t = typename std::remove_reference_t<decltype(*c)>::packet_id_t;

    // Setup client
    c->set_client_id("cid1");

    // no halfway packets
    c->set_clean_session(true);

    // explicit call for demonstrate setting (behavior isn't changed)
    //                     enable  sync  (same as the default)
    c->set_auto_pub_response(true, false);

    // Setup handlers
    c->set_connack_handler(
        [&c]
        (bool sp, std::uint8_t connack_return_code){
            std::cout << "Connack handler called" << std::endl;
            std::cout << "Clean Session: " << std::boolalpha << sp << std::endl;
            std::cout << "Connack Return Code: "
                      << mqtt::connect_return_code_to_str(connack_return_code) << std::endl;
            if (connack_return_code == mqtt::connect_return_code::accepted) {
                // async version (It is safe because of clean session.)
                c->async_publish(
                    "register",
                    "I am cid1",
                    mqtt::qos::at_least_once,
                    false,
                    [c](boost::system::error_code const& ec) {
                        std::cout << ec.message() << std::endl;
                        if (ec) {
                            // sync version
                            c->disconnect();
                            return;
                        }
                        // sync_version
                        c->subscribe("topic1", mqtt::qos::at_most_once);
                    }
                );
            }
            return true;
        });
    c->set_close_handler(
        []
        (){
            std::cout << "closed." << std::endl;
        });
    c->set_error_handler(
        []
        (boost::system::error_code const& ec){
            std::cout << "error: " << ec.message() << std::endl;
        });
    c->set_unsuback_handler(
        [&]
        (packet_id_t /*packet_id*/){
            // async version (It is safe because of unsubscribe is finished.)
            c->async_publish(
                "unregister",
                "I am cid1",
                mqtt::qos::at_least_once,
                false,
                [c](boost::system::error_code const& ec) {
                    std::cout << ec.message() << std::endl;
                    if (ec) {
                        // sync version
                        c->disconnect();
                        return;
                    }
                }
            );
            return true;
        }
    );

    c->set_publish_handler(
        [&]
        (std::uint8_t header,
         mqtt::optional<packet_id_t> /*packet_id*/,
         std::string topic_name,
         std::string contents){
            auto dup = mqtt::publish::is_dup(header);
            auto qos = mqtt::publish::get_qos(header);
            auto retain = mqtt::publish::is_retain(header);
            std::cout << "publish received. "
                      << "dup: " << std::boolalpha << dup
                      << " qos: " << mqtt::qos::to_str(qos)
                      << " retain: " << retain << std::endl;
            std::cout << "topic_name: " << topic_name << std::endl;
            std::cout << "contents: " << contents << std::endl;

            // sync_version
            c->unsubscribe("topic1");
            return true;
        });

    // connect is always async even if name is `connect()`.
    c->connect();

    ios.run();
}
```

I don't test the code.

**Comment by marcel-behlau-elfin** [comment]
Okay, will work for me. 

Thx for your fast support!
